NOME;PONTUACAO;COMENTARIO;LOCAL;TIPO;TEMPO_ESPERA;BUSCA_ID
Complexo Crocobeach;4.6;32.492 comentários;Av. Clóvis Arrais Maia, 3125 - Praia Do Futuro, Fortaleza - CE, 60182-324;$$;;drive thru
Drive-Thru Clementino Fraga Patologia Clínica Central | Laboratório, Análises Clínicas, Exames de sangue.;2.3;3 comentários;R. Carlos Vasconcelos, 927 - Meireles, Fortaleza - CE, 60115-170;Laboratório médico em Fortaleza, Ceará;;drive thru
McDonald's;;;Av. Santos Dumont, 6060 - Cocó, Fortaleza - CE, 60192-022;$$;20 min;drive thru
McDonald's;;;Av. Santos Dumont, 1710 - Aldeota, Fortaleza - CE, 60150-160;$$;25 min;drive thru
Coco Bambu Coffee Break: Cafés, Padaria, Restaurante, Drive Thru, Fortaleza CE;4.6;615 comentários;R. Barão de Aracati, 1060 - Aldeota, Fortaleza - CE, 60115-081;$$$;25 min a 1,5 h;drive thru
McDonald's;;;Av. Dom Luís, 1200 - Loja 01 - Aldeota, Fortaleza - CE, 60160-230;$$;15 min;drive thru
RioMar Kennedy;4.6;35.792 comentários;Av. Sgt. Hermínio Sampaio, 3100 - Pres. Kennedy, Fortaleza - CE, 60355-512;Shopping center;;drive thru
Habib's Aldeota: Esfirra, Kibe, Sanduíche, Delivery, Fortaleza CE;;;Av. da Abolição, 1780 - Meireles, Fortaleza - CE, 60165-080;$$;20 min a 1 h;drive thru
Dunada Burger;5.0;21 comentários;M dias branco - R. dos Cajueiros, 1421 - Fortaleza, CE, 60190-620;Hamburgueria;;drive thru
Habib's Treze de Maio: Esfirra, Kibe, Sanduíche, Delivery, Fortaleza CE;;;Av. Treze de Maio, 1746 - Fátima, Fortaleza - CE, 60040-531;$$;15 min a 1 h;drive thru
McDonald's;;;R. Des. Lauro Nogueira, 1500 - Papicu, Fortaleza - CE, 60176-065;$$;;drive thru
Iracemado Lanches;5.0;2 comentários;R. dos Cajueiros, 1593 - Cidade 2000, Fortaleza - CE, 60190-620;Restaurante fast-food;;drive thru
The Waffle King Fortaleza;4.5;101 comentários;R. Dr. Gilberto Studart, 155 - Loja 09 - Cocó, Fortaleza - CE, 60192-105;Restaurante fast-food;10 min;drive thru
El Ranchero Hamburgueria;4.4;31 comentários;R. João Cordeiro, 201 - Praia de Iracema, Fortaleza - CE, 60110-355;Hamburgueria;30 min a 1 h;drive thru
Point do Lanche;5.0;23 comentários;R. Sen. Pompeu, 1539 - Centro, Fortaleza - CE, 60025-000;$;;drive thru
Júnior da Picanha;4.4;2.045 comentários;Av. Nilo Gomes de Soares, 201 - Cidade 2000, Fortaleza - CE, 60190-630;$$;1-2,5 horas;drive thru
Mr. Fruit Açaí Fortaleza;5.0;2 comentários;R. Barão do Rio Branco, 927 - Centro, Fortaleza - CE, 60025-060;Loja de açaí;;drive thru
Sorvete da Reserva;4.8;192 comentários;Rua Torres Câmara, 100 - loja 03 - Aldeota, Fortaleza - CE, 60150-060;Sorveteria;;drive thru
Farmácia Dose Certa Água Fria: Delivery, Medicamento, Vitaminas, Fortaleza CE;3.0;46 comentários;Av. Washington Soares, 1500 - Água Fria, Fortaleza - CE, 60811-341;Empresa farmacêutica em Fortaleza, Ceará;;drive thru
Two Brothers Cocó: Pizza, Massas, Calzones, Pizzaria, Delivery, Fortaleza CE;3.3;40 comentários;R. Batista de Oliveira, 1071 - Cocó, Fortaleza - CE, 60192-340;Pizzaria;;drive thru
Skyna by Brend Burguer;;;Rua Jaime Benévolo № 107 - Centro, Fortaleza - CE, 60050-080;;30 min a 1,5 h;drive thru
Complexo Crocobeach;4.6;32.492 comentários;Av. Clóvis Arrais Maia, 3125 - Praia Do Futuro, Fortaleza - CE, 60182-324;$$;;drive thru
Burger King;4.4;302 comentários;"R. Carapinima, 2200 - Loja: 229/230;, 2200 - Benfica, Fortaleza - CE, 60015-290";$$;;drive thru
BBQ5;4.5;312 comentários;R. Bento Albuquerque - Cocó, Fortaleza - CE, 60192-055;Restaurante especializado em carnes;30 min a 1,5 h;drive thru
Macarronada É Massa;3.8;14 comentários;R. Gen. Sampaio, 1235 - Centro, Fortaleza - CE, 60020-030;Restaurante italiano;;drive thru
Shopping RioMar Fortaleza;4.7;52.466 comentários;R. Des. Lauro Nogueira, 1500 - Papicu, Fortaleza - CE, 60175-055;Shopping center em Fortaleza, Ceará;45 min a 3 h;drive thru
Churrasquinho efata;;;R. dos Cajueiros, 1357 - Cidade 2000, Fortaleza - CE, 60190-620;;;drive thru
Food Brazil;4.8;37 comentários;R. Major Facundo, 833 - Centro, Fortaleza - CE, 60025-100;Restaurante;30 min a 1 h;drive thru
Iguatemi Bosque;4.7;72.431 comentários;Av. Washington Soares, 85 - Edson Queiroz, Fortaleza - CE, 60811-341;Shopping center em Fortaleza, Ceará;45 min a 3 h;drive thru
Hanna's Restaurante | Self Service | Centro;4.4;1.332 comentários;R. Major Facundo, 736 - Centro, Fortaleza - CE, 60025-100;$$;45 min;drive thru
Donastela Massas e Recheios;3.7;3 comentários;R. Major Facundo, 897 - Centro, Fortaleza - CE, 60025-100;Restaurante italiano;;drive thru
Rose's Cafeteria & Restaurante;4.8;19 comentários;R. Pedro Borges, 33 - Loja 01 - Centro, Fortaleza - CE, 60055-120;Cafeteria;25 min a 1 h;drive thru
galeteria o chefão;4.1;41 comentários;avenida central leste - Cidade 2000, Fortaleza - CE, 60190-611;Restaurante;30 min;drive thru
Frangolândia Supermercado Santos Dumont: Carnes, Frutas, Delivery em Fortaleza CE;4.3;2.713 comentários;Av. Santos Dumont, 5916 - Papicu, Fortaleza - CE, 60191-156;Supermercado;15-45 min;drive thru
Point do Pesk Pag;4.6;5 comentários;Av. Nila Gomes de Soárez, 403 - Cidade 2000, Fortaleza - CE, 60190-630;Restaurante;;drive thru
Delícias da Gê;5.0;3 comentários;edifício palácio do sol - Rua Solon Pinheiro, 116 - sala 202 - Centro, Fortaleza - CE, 60050-040;Restaurante;;drive thru
Brokado's Pizza;4.8;34 comentários;Av. Nila Gomes de Soárez, 400 - Sala 8 - Cidade 2000, Fortaleza - CE, 60190-630;Pizzaria;;drive thru
Emilio Ribas;2.7;14 comentários;Shopping Iguatemi, 85 - Edson Queiroz, Fortaleza - CE, 60811-341;Laboratório médico em Fortaleza, Ceará;;drive thru
The Coffee;4.3;9 comentários;Av. Dom Luís, 1200 - Meireles, Fortaleza - CE, 60160-230;Cafeteria;;drive thru
Delicious Pizzaria;4.6;44 comentários;Alameda Das Miosótes, 405 - Cidade 2000, Fortaleza - CE, 60190-490;Delivery de Pizza;;drive thru
Café de Oyá;5.0;3 comentários;R. Manuelito Moreira, 96 - Benfica, Fortaleza - CE, 60025-210;Bar;;drive thru
Del Plata Pastas;4.9;128 comentários;Rua Santa Maria, 2 - José Bonifacio, Fortaleza - CE, 60025-110;Restaurante;1,5 horas;drive thru
Brazinha Grill 2;4.3;154 comentários;Rua General Bezerril, 590 - Centro, Fortaleza - CE, 60055-100;Restaurante;30 min;drive thru
Complexo Crocobeach;4.6;32.492 comentários;Av. Clóvis Arrais Maia, 3125 - Praia Do Futuro, Fortaleza - CE, 60182-324;$$;;drive thru
Shopping Metrô;4.2;7.139 comentários;Rua 24 de Maio - Centro, Fortaleza - CE;Shopping center em Fortaleza, Ceará;15-45 min;drive thru
Secretaria da Saúde do Estado do Ceará;2.2;178 comentários;Av. Almirante Barroso, 600 - Praia de Iracema, Fortaleza - CE, 60060-440;Departamento de saúde pública em Fortaleza, Ceará;;drive thru
Império dos salgados;;;R. Sen. Pompeu, 1211 - Centro, Fortaleza - CE, 60025-000;;;drive thru
Zoá Gastrobar;4.7;54 comentários;R. Visc. de Mauá, 2217 - Dionísio Torres, Fortaleza - CE, 60125-161;Restaurante;45 min a 2 h;drive thru
Marmitaria tempero da Mary;3.7;6 comentários;R. Manoel Marques, 232 - Manuel Dias Branco, Fortaleza - CE, 60191-675;Restaurante de comida caseira;;drive thru
baratoexpress.ce;5.0;Um comentário;R. Floriano Peixoto, 773 - Centro, Fortaleza - CE, 60025-130;Loja de moda feminina em Fortaleza, Ceará;;drive thru
Marmitaria e churrasquinho Rosana;;;Miguel calmont 526, Fortaleza - CE, 60821-200;;;drive thru
Doceria da Thatha;5.0;5 comentários;Rua Sousa Girão, 115 - José Bonifacio, Fortaleza - CE, 60055-370;Doceria;;drive thru
LT vision;4.3;4.251 comentários;R. Sen. Pompeu, 856 - Centro, Fortaleza - CE, 60025-000;Shopping center em Fortaleza, Ceará;15-45 min;drive thru
Uritu Cafés Especiais: Cafés, Utensílios, Empório, Centro, Fortaleza;4.9;51 comentários;Rua Dona Leopoldina, 396 - Centro, Fortaleza - CE, 60110-000;Atacadista de café;10 min a 1 h;drive thru
Mercadão Shopping;4.3;4.722 comentários;Rua 24 de Maio, 411 - Centro, Fortaleza - CE, 60020-030;Shopping center em Fortaleza, Ceará;10-45 min;drive thru
Hospital Geral de Fortaleza (HGF);3.9;100 comentários;R. Ávila Goularte, 900 - Papicu, Fortaleza - CE, 60150-160;Hospital geral em Fortaleza, Ceará;;drive thru
Ban Ban Calçados RioMar: Sapatos Femininos, Masculinos, Infantil, Fortaleza CE;4.3;485 comentários;R. Des. Lauro Nogueira, 1500 - Papicu, Fortaleza - CE, 60176-065;Loja de calçado em Fortaleza, Ceará;15 min;drive thru
Extrafarma Duque de Caxias;4.0;34 comentários;Av. Duque de Caxias, 808 - Centro, Fortaleza - CE, 60035-110;Farmácia em Fortaleza, Ceará;15 min;drive thru
Jambalera confeitaria vegana;5.0;20 comentários;Av. Domingos Olímpio, 391 - José Bonifacio, Fortaleza - CE, 60040-081;Confeitaria;;drive thru
POLO WEAR;4.5;948 comentários;Av. Washington Soares, 85 - Loja 621 - Edson Queiroz, Fortaleza - CE, 60811-341;Loja de roupa em Fortaleza, Ceará;15 min;drive thru
Tendicell;5.0;2 comentários;Av. Duque de Caxias, 114 - Centro, Fortaleza - CE, 60035-110;Loja de celulares em Fortaleza, Ceará;;drive thru
Galeria Frangão;;;RESIDÊNCIA CIDADE - RUA 16 CID JD, QD 08 LT 06 12, AP 102 - JARDIM II, Fortaleza - CE, 60748-445;;;drive thru
Loja Oficial Mormaii Shopping RioMar Fortaleza - CE;;;Shopping Rio Mar - R. Des. Lauro Nogueira, 1500 - Papicu, Fortaleza - CE, 60175-055;;;drive thru
Smart Games;4.9;1.565 comentários;R. Sen. Pompeu, 1099 - Centro, Fortaleza - CE, 60025-000;Loja de videogame em Fortaleza, Ceará;10 min;drive thru
Complexo Crocobeach;4.6;32.492 comentários;Av. Clóvis Arrais Maia, 3125 - Praia Do Futuro, Fortaleza - CE, 60182-324;$$;;drive thru
Feijoada Brasil;4.2;10 comentários;Av. das Adenanteras, 689a - Cidade 2000, Fortaleza - CE, 60190-560;Delivery;;drive thru
Iaçá: Açai, Distribuidora, Polpa, Açai do Pará, Açai Iaça, Belém, Fortaleza CE;5.0;8 comentários;R. Sen. Alencar, 652 - Loja 2 - Centro, Fortaleza - CE, 60030-050;Delivery;;drive thru
Vibe 085;4.6;172 comentários;Rua Manuel Queirós, 511 - Cocó, Fortaleza - CE, 60192-220;$$;1,5-4,5 horas;drive thru
Livraria e Papelaria Interativa;4.0;158 comentários;R. Major Facundo, 874 - Centro, Fortaleza - CE, 60025-100;Livraria em Fortaleza, Ceará;;drive thru
Centro de Eventos do Ceará;;;Av. Washington Soares, 999 - Edson Queiroz, Fortaleza - CE;Local para eventos em Fortaleza, Ceará;;drive thru
Suits Instinto Br;4.7;67 comentários;Av. Tristão Gonçalves, 765 - Centro, Fortaleza - CE, 60015-000;Loja de roupas para ocasiões formais em Fortaleza, Ceará;;drive thru
Aroma e bombom doces e salgados;5.0;3 comentários;Alameda dos Lírios, Quadra 21 - número 355 - Cidade 2000, Fortaleza - CE, 60190-530;Doceria;;drive thru
Só Livros Fortaleza;4.6;192 comentários;Rua 24 de Maio, 822 - loja 15 Shopping Center Maio Centro /whats (85) 98888 4000 / 10x no cartão, Fortaleza - CE, 60020-000;Sebo em Fortaleza, Ceará;20 min;drive thru
Classicline;5.0;12 comentários;Av. Santos Dumont, 266 - Centro, Fortaleza - CE, 60150-160;Loja de DVDs em Fortaleza, Ceará;;drive thru
New Fashion Flores;4.9;9 comentários;R. Pedro Borges, 135 - Centro, Fortaleza - CE, 60055-110;Floricultura em Fortaleza, Ceará;;drive thru
HICK CELL;4.4;14 comentários;R. Guilherme Rocha, 166 - Centro, Fortaleza - CE, 60030-140;Loja de eletrônicos em Fortaleza, Ceará;;drive thru
Sh82 Café;5.0;10 comentários;R. Floriano Peixoto, 1375 B - Centro, Fortaleza - CE, 60025-130;Cafeteria;;drive thru
Tech Store - Assistência técnica em Smartphone e Tablets;4.2;60 comentários;R. Major Facundo, 1011 - Centro, Fortaleza - CE, 60025-100;Loja de celulares em Fortaleza, Ceará;;drive thru
Moncloa Tea Boutique;4.8;20 comentários;R. Des. Lauro Nogueira, 1500 - Papicu, Fortaleza - CE, 60176-065;Loja de chás;;drive thru
Fortaleza Ceará;;;Av. da Abolição - Meireles, Fortaleza - CE, 60125-160;;;drive thru
Carimbos Automático Carimbos MSD/Gráfica Rápida;4.8;32 comentários;R. Barão do Rio Branco, 1224 - Centro, Fortaleza - CE, 60025-060;Loja de carimbos em Fortaleza, Ceará;;drive thru
Ld Multimarcas;5.0;2 comentários;R. Dr. Gilberto Studart, 2865 A - Manuel Dias Branco, Fortaleza - CE, 60191-365;Loja de moda masculina em Fortaleza, Ceará;;drive thru
Núcleotec;4.6;120 comentários;Av. Domingos Olímpio, 591A - José Bonifacio, Fortaleza - CE, 60040-115;Assistência técnica em Fortaleza, Ceará;20 min a 1 h;drive thru
IMPERIO DO BOLO;4.6;7 comentários;R. Edgar Borges, 74 - Centro, Fortaleza - CE, 60050-000;Doceria;;drive thru
Floricultura Cantinho das Flores;4.5;24 comentários;R. Franklin Távora, 220 - Centro, Fortaleza - CE, 60150-110;Floricultura em Fortaleza, Ceará;;drive thru
Complexo Crocobeach;4.6;32.492 comentários;Av. Clóvis Arrais Maia, 3125 - Praia Do Futuro, Fortaleza - CE, 60182-324;$$;;drive thru
Comercial de Estivas e Cereais Giovanna;4.6;7 comentários;Rua Governador Sampaio, 92 - Centro, Fortaleza - CE, 60055-050;Limpeza;;drive thru
Tabacaria Smoking Cash (Quiosque);5.0;5 comentários;R. Sen. Pompeu, 1099 - Centro, Fortaleza - CE, 60020-000;Tabacaria em Fortaleza, Ceará;10 min;drive thru
Sonhar buffet móvel;5.0;Um comentário;R. Barão de Aratanha, 704 - José Bonifacio, Fortaleza - CE, 60050-071;Buffet de doces e sobremesas;;drive thru
Azilado Em Games;4.4;414 comentários;Corredor Principal Ao Lado Da VIVO - Av. Washington Soares, 85 - Loja 33B - Edson Queiroz, Fortaleza - CE, 60811-900;Loja de informática em Fortaleza, Ceará;;drive thru
CRC Pet;4.8;52 comentários;Av. Duque de Caxias, 12 - Centro, Fortaleza - CE, 60035-110;Pet Shop;;drive thru
Universo Nerd - Ce;;;R. Gen. Sampaio, 1193 - Centro, Fortaleza - CE, 60020-030;;;drive thru
ORTOBOM CENTRO FORTALEZA;4.9;139 comentários;R. Pedro Pereira, 267 - Centro, Fortaleza - CE, 60035-000;Loja de colchões em Fortaleza, Ceará;;drive thru
CRC Pet -Loja I;4.7;109 comentários;R. Conde d'Eu, 521 - Centro, Fortaleza - CE, 60055-070;Pet shop em Fortaleza, Ceará;;drive thru
Casa Veneza Calçados;4.0;5 comentários;Rua Major Facundo, 630 com Liberato Barroso Rua Major Facundo, Praça do Ferreira, 604 - Centro, Fortaleza - CE, 60025-080;Loja de calçado em Fortaleza, Ceará;;drive thru
Lojas Center Aço Fortaleza - Gondolas e Prateleiras;4.3;49 comentários;Av. Dom Manuel, 1251 - Centro, Fortaleza - CE, 60060-091;Loja de prateleiras;;drive thru
Vitrines Semi-jóias e Folheados;4.9;56 comentários;Rua Barão do Rio Branco, 1071 Edifício Lobrás, 9º andar - Sala 914 - Centro, Fortaleza - CE, 60025-061;Joalheiro atacadista em Fortaleza, Ceará;;drive thru
Rei Leão Outlet;;;R. Sen. Pompeu, 856 - Loja 07 - Shopping Central, Fortaleza - CE, 60025-000;;;drive thru
Top1 suplementos;5.0;3 comentários;R. Barão do Rio Branco, 1620 - Centro, Fortaleza - CE, 60025-060;Loja de vitaminas e suplementos em Fortaleza, Ceará;;drive thru
Ban Ban Calçados Major Facundo: Sapatos Femininos, Masculinos, Infantil, Fortaleza CE;4.5;29 comentários;R. Major Facundo, 484 - Centro, Fortaleza - CE, 60055-100;Loja de calçado em Fortaleza, Ceará;;drive thru
Vivaz Br;3.2;9 comentários;Alameda Maria Doralice, 80 - Cidade 2000, Fortaleza - CE, 60190-170;Loja de roupas de praia em Fortaleza, Ceará;;drive thru
Legal Patas Pet Shop;4.3;70 comentários;R. Carlos Vasconcelos, 1136 - Aldeota, Fortaleza - CE, 60115-170;Pet shop em Fortaleza, Ceará;;drive thru
Sodine Varejo Centro: Papelaria, Material de escritório, Informática, Fortaleza CE;4.2;439 comentários;R. Floriano Peixoto, 230 - Centro, Fortaleza - CE, 60025-130;Loja de produtos de papelaria em Fortaleza, Ceará;20 min a 1 h;drive thru
Clube de Tiro Rios Pro Tactical;5.0;30 comentários;R. Barão do Rio Branco, 2286 - José Bonifacio, Fortaleza - CE, 60025-061;Loja de armas em Fortaleza, Ceará;;drive thru
Nordeste celular Oficial;3.9;30 comentários;R. Pedro 1, 715 - Centro, Fortaleza - CE, 60035-100;Loja de celulares em Fortaleza, Ceará;;drive thru
Lider Peças Shineray Centro: Peças, Motos, Carenagem, em Fortaleza CE;4.5;45 comentários;R. Gen. Clarindo de Queiroz, 770 - Loja 04 - Centro, Fortaleza - CE, 60035-130;Loja de peças para motocicletas em Fortaleza, Ceará;;drive thru
Complexo Crocobeach;4.6;32.492 comentários;Av. Clóvis Arrais Maia, 3125 - Praia Do Futuro, Fortaleza - CE, 60182-324;$$;;drive thru
Kiosk Hospitalar;5.0;3 comentários;R. Barão do Rio Branco, 1921 - Centro, Fortaleza - CE, 60025-061;Loja de artigos hospitalares em Fortaleza, Ceará;;drive thru
Fort Tudo | Artigos de Decoração, Brinquedos, Utilidades, Bebê, Caça e Pesca em Fortaleza;4.4;3.908 comentários;R. Gen. Sampaio, 1300 - Centro, Fortaleza - CE, 60020-031;Loja de departamento em Fortaleza, Ceará;20 min a 1 h;drive thru
SUPER SAFRA DISTRIBUIDORA DE ALIMENTOS EIRELI;4.3;3 comentários;Rua Governador Sampaio, 338 - Centro, Fortaleza - CE, 60055-050;Atacadista em Fortaleza, Ceará;;drive thru
Cake Mania By Adriana Pessoa;4.5;24 comentários;Alameda Nadja, 334 - Quadra 8 - Cidade 2000, Fortaleza - CE, 60190-230;Confeitaria;;drive thru
Boa Opção;4.8;5 comentários;Rua Bárbara de Alencar, 310 - Centro, Fortaleza - CE, 60140-000;Loja de calçado em Fortaleza, Ceará;;drive thru
COMFER - Material de Construção no Centro de Fortaleza;4.7;7 comentários;R. Pinto Madeira, 11 - Centro, Fortaleza - CE, 60150-000;Loja de materiais de construção em Fortaleza, Ceará;;drive thru
Bolos confeitados - Bolos em fortaleza - Kátia Silva Cakes - Fortaleza (CE);5.0;6 comentários;R. Marconi, 85 - Farias Brito, Fortaleza - CE, 60015-190;Confeitaria;;drive thru
Folha Leve;4.6;54 comentários;Av. Alberto Nepomuceno, 113 - loja 56 - Centro, Fortaleza - CE, 60030-010;Loja de moda feminina em Fortaleza, Ceará;;drive thru
Talismã Essências: Perfume, Difusores, Óleos Essenciais, Perfumaria, Fortaleza CE;4.7;32 comentários;R. Pedro 1, 725 - Centro, Fortaleza - CE, 60035-100;Perfumaria em Fortaleza, Ceará;25 min;drive thru
Lili Bolsas;4.4;51 comentários;R. Major Facundo, 434a - Centro, Fortaleza - CE, 60025-100;Loja de malas e bolsas em Fortaleza, Ceará;15 min a 1 h;drive thru
Casa Fátima;4.4;249 comentários;R. Liberato Barroso, 41 - Centro, Fortaleza - CE, 60030-160;Armarinho em Fortaleza, Ceará;15 min;drive thru
Digital Fotos;4.7;61 comentários;R. Sen. Pompeu, 1391 - Centro, Fortaleza - CE, 60025-001;Loja de artigos para fotografia em Fortaleza, Ceará;20 min;drive thru
DISTRIBUIDORA TROPICAL PNEUS(VENDAS ATACADO);4.4;25 comentários;Rua 24 de Maio, 1115 - Centro, Fortaleza - CE, 60020-001;Serviço de distribuição em Fortaleza, Ceará;;drive thru
GoldenKap;4.8;82 comentários;Rua Gervásio Gurgel, 23 - Centro, Fortaleza - CE, 60060-100;Loja de tapetes em Fortaleza, Ceará;;drive thru
Elétrica Fortaleza;5.0;3 comentários;R. Pedro 1, 639 - Centro, Fortaleza - CE, 60035-100;Loja de materiais elétricos em Fortaleza, Ceará;;drive thru
Catedral Tecidos;4.5;417 comentários;Rua General Bezerril, 48 - Centro, Fortaleza - CE, 60055-100;Loja de tecidos em Fortaleza, Ceará;25 min a 1 h;drive thru
Moto Bonas;4.1;27 comentários;Rua 24 de Maio, 1162 - Centro, Fortaleza - CE, 60020-001;Loja de peças para motocicletas em Fortaleza, Ceará;;drive thru
Herbalife Fortaleza;5.0;Um comentário;R. José Gomes de Moura, 91 - José Bonifacio, Fortaleza - CE, 60040-010;Loja de vitaminas e suplementos em Fortaleza, Ceará;;drive thru
Jô Case;3.8;4 comentários;R. Barão do Rio Branco, 952 - Centro, Fortaleza - CE, 60025-060;Loja de celulares em Fortaleza, Ceará;;drive thru
Ópticas Itamaraty- Centro Fortaleza;4.9;329 comentários;R. Liberato Barroso, 17 - Centro, Fortaleza - CE, 60030-160;Ótica em Fortaleza, Ceará;25 min a 1,5 h;drive thru
Complexo Crocobeach;4.6;32.492 comentários;Av. Clóvis Arrais Maia, 3125 - Praia Do Futuro, Fortaleza - CE, 60182-324;$$;;drive thru
Prefeitura Municipal de Fortaleza | Paço Municipal;3.7;144 comentários;Rua São José, 01 - Centro, Fortaleza - CE, 60060-170;Prefeitura em Fortaleza, Ceará;;drive thru
Anmap Metais: Fita Nylon, Fivela, Rebite, Mosquetao, Acessorios PET, Fortaleza CE;5.0;138 comentários;R. Sen. Alencar, 760 - Centro, Fortaleza - CE, 60030-050;Loja de suprimentos para animais de estimação em Fortaleza, Ceará;15 min;drive thru
Senhorita Pink;;;Rua São José, 84 - Banca 177 - Centro, Fortaleza - CE, 60060-170;;;drive thru
Infortudo;4.6;13 comentários;Rua Perboyre e Silva, 60 - Centro, Fortaleza - CE, 60030-200;Loja de informática em Fortaleza, Ceará;;drive thru
Galeria Itália;5.0;7 comentários;Rua General Bezerril 706, R. Edgar Borges, 77 - Centro, Fortaleza - CE, 60055-100;Loja de moda feminina em Fortaleza, Ceará;;drive thru
Edson Livros;4.5;2 comentários;Rua General Bezerril, 390 - Centro, Fortaleza - CE, 60055-100;Livraria em Fortaleza, Ceará;;drive thru
CABEMCE - Caixa Beneficente dos Militares do Ceará;4.1;60 comentários;Av. Domingos Olímpio, 1589 - Farias Brito, Fortaleza - CE, 60015-103;Assistente social em Fortaleza, Ceará;;drive thru
Master Clinica;5.0;4 comentários;Rua Pedro Pereira 460 sala 308 3* Andar - Centro, Fortaleza - CE, 60035-000;Clínica oftalmológica em Fortaleza, Ceará;;drive thru
Livraria 4 Idiomas;3.9;51 comentários;Praça dos Leões - Rua General Bezerril, 396 - Centro, Fortaleza - CE, 60055-100;Livraria em Fortaleza, Ceará;;drive thru
KSA Conceito;5.0;32 comentários;R. Andrade Furtado, 2530 - Manuel Dias Branco, Fortaleza - CE, 60191-345;Loja de roupa em Fortaleza, Ceará;;drive thru
Rey Cell;4.9;19 comentários;Loja 05 - Mercadão Shopping, Rua 24 de Maio, 411 - Centro, Fortaleza - CE, 60020-000;Loja de celulares em Fortaleza, Ceará;10 min;drive thru
Dulare Móveis e Eletros;1.4;70 comentários;R. Barão do Rio Branco, 1189 - Centro, Fortaleza - CE, 60025-060;Loja de móveis em Fortaleza, Ceará;;drive thru
Flávio Pulseiras e Fornituras;4.2;61 comentários;Galeria Pedro Jorge, R. Sen. Pompeu, 834 - Loja 33 - Centro, Fortaleza - CE, 60025-000;Loja de variedades em Fortaleza, Ceará;;drive thru
Yexb Jeans;;;Av. Visconde do Rio Branco, 1592 - Centro, Fortaleza - CE, 60055-170;;;drive thru
Anmap Sintéticos: Fivelas, Aviamentos, Fitas para alças, Carpete, Fortaleza CE;5.0;117 comentários;Av. Tristão Gonçalves, 199 - Centro, Fortaleza - CE, 60015-000;Loja de artigos de couro em Fortaleza, Ceará;;drive thru
Ponto Das Crianças;4.9;19 comentários;R. Edgar Borges, 28 - Centro, Fortaleza - CE, 60050-000;Loja para bebê em Fortaleza, Ceará;;drive thru
Miranda biju;5.0;Um comentário;R. Sobral, 160 - loja 59 - Centro, Fortaleza - CE, 60030-030;Loja de acessórios de moda em Fortaleza, Ceará;;drive thru
Irmão Luis Conserto de Óculos: Armação, Haste, Perna, Centro, Fortaleza CE;4.9;17 comentários;R. Guilherme Rocha, 253 - 8º andar - Centro, Fortaleza - CE, 60030-140;Ótica em Fortaleza, Ceará;;drive thru
Groaíras Variedades;4.6;14 comentários;R. Gen. Sampaio, 599 - Centro, Fortaleza - CE, 60020-030;Loja de variedades em Fortaleza, Ceará;;drive thru
Óculos Atípico;3.8;6 comentários;Rua Barão do Rio Branco 1182 Shopping Camelo 2 - Centro, Fortaleza - CE, 60025-060;Ótica em Fortaleza, Ceará;15 min;drive thru
SM DANI;;;Av. Visconde do Rio Branco, 1605 - Centro, Fortaleza - CE, 60055-170;;;drive thru
Arrasa Pet - Fabricante De Acessórios Pet;4.6;10 comentários;R. Sen. Pompeu, 856 - loja 90 - Centro, Fortaleza - CE, 60025-000;Pet shop em Fortaleza, Ceará;;drive thru
Trok Tok Musical;4.6;602 comentários;R. Pedro Pereira, 604 - Centro, Fortaleza - CE, 60035-000;Loja de instrumentos musicais em Fortaleza, Ceará;15 min a 1 h;drive thru
Anmap Borracha: Tatame, EVA, Grama Sintetica, Piso Emborrachado, Fortaleza CE;5.0;136 comentários;R. Sen. Alencar, 652 - Centro, Fortaleza - CE, 60030-050;Fornecedor de produtos de borracha em Fortaleza, Ceará;20 min;drive thru
Casa Católica - Artigos Religiosos;4.7;16 comentários;R. Major Facundo, 353 - Centro, Fortaleza - CE, 60025-100;Loja de artigos religiosos em Fortaleza, Ceará;;drive thru
Nacional Dental;4.5;116 comentários;Rua: Marcondes Pereira, 550 - Joaquim Távora (Fortaleza), Fortaleza - CE, 60130-060;Loja em Fortaleza, Ceará;15 min;drive thru
Perfil Molduras | Quadros e Espelhos em Fortaleza;4.7;422 comentários;R. Vinte e Cinco de Março, 375 - Centro, Fortaleza - CE, 60060-120;Loja de molduras em Fortaleza, Ceará;15 min;drive thru
Megacell Fortaleza;;;Barão do rio Branco 1121, R. Liberato Barroso, 131, Fortaleza - CE, 60025-060;;;drive thru
Distribuidora Lisboa;4.1;23 comentários;Distribuidora Lisboa - R. Visc. Sabóia, 116 - Centro, Fortaleza - CE, 60030-090;Depósito em Fortaleza, Ceará;;drive thru
Tele Eletrônica Som e Instrumentos Musicais;4.5;939 comentários;R. Pedro Pereira, 518 - Centro, Fortaleza - CE, 60035-000;Loja de instrumentos musicais em Fortaleza, Ceará;20 min a 1 h;drive thru
Almeida Costura;4.9;295 comentários;R. Pedro 1, 587 - Centro, Fortaleza - CE, 60035-100;Loja de máquinas de costura em Fortaleza, Ceará;;drive thru
Espaço Herbalife Nutrition - @EVSSETPLUS;5.0;2 comentários;Edifício Palácio Progresso - R. Pedro Borges, 33 - 3° andar sala 303 - Centro, Fortaleza - CE, 60055-110;Casa de chá;;drive thru
Fortaleza, Ceará;;;Rodolfo Teófilo, Fortaleza - CE, 60430-120;;;drive thru
ÓPTICA SUPER VISION - Óculos de grau, Lentes de Contato e Exame de Vista.;5.0;13 comentários;R. Pedro Pereira, 460 - sala 314, 3ºandar - Centro, Fortaleza - CE, 60035-000;Ótica em Fortaleza, Ceará;;drive thru
Fortaleza Ceará;;;R. K Lt Cidade Verde, 63 - São Bento, Fortaleza - CE, 60875;;;drive thru
Fortaleza Ceará;;;Rua Nossa Senhora de Fátima, 1827 - Canindezinho, Fortaleza - CE, 60731-455;;;drive thru
Bellatex;4.7;96 comentários;Avenida Imperador, 666 - Centro, Fortaleza - CE, 60015-050;Loja de tecidos em Fortaleza, Ceará;20 min a 1 h;drive thru
Dental Fortaleza Ltda;4.6;13 comentários;Rua do Rosário, 46 - Centro, Fortaleza - CE, 60055-090;Loja de produtos odontológicos em Fortaleza, Ceará;;drive thru
ÓTICA DIGITAL;4.8;4 comentários;R. da Assunção, 517 - José Bonifacio, Fortaleza - CE, 60050-010;Ótica em Fortaleza, Ceará;;drive thru
